<!ELEMENT partidos (partido+)>
<!ELEMENT partido (ID_JORNADA, EQUIPO_1, EQUIPO_2, EQUIPO_GANADOR)>
<!ELEMENT ID_JORNADA (#PCDATA)>
<!ELEMENT EQUIPO_1 (#PCDATA)>
<!ELEMENT EQUIPO_2 (#PCDATA)>
<!ELEMENT EQUIPO_GANADOR (#PCDATA)>
